<?xml version="1.0" encoding="UTF-8"?>
<!--
To change this license header, choose License Headers in Project Properties.
To change this template file, choose Tools | Templates
and open the template in the editor.
-->


<modelo
    xmlns:xsi='http://www.w3.org/2001/XMLSchema-instance'
    xsi:noNamespaceSchemaLocation='modelocomplejo.xsd'>
    <curso>1</curso>
    <ciclo>ASIR</ciclo>
    <nombreA>Lenguaje de Marcas y Gestion de la Informacion</nombreA>
    <codigoPostal>49600</codigoPostal>
    <comentario>Este ciclo tiene  una insercion laboral de     100%</comentario>
    <temperatura>32.20</temperatura>
    <codigoAsignatura>EDD</codigoAsignatura>
    <profesor codP="ARN" modI="LMGSI">Amor Rodriguez</profesor>
</modelo>
